ffff8d4c500b8d80 2288678829 C Ii:1:022:2 -108:8 0
ffff8d4c469776c0 2288692490 S Ci:1:022:0 s 80 06 0300 0000 0004 4 <
ffff8d4c469776c0 2288692645 C Ci:1:022:0 0 4 = 04030904
ffff8d4c469776c0 2288692661 S Ci:1:022:0 s 80 06 0302 0409 00ff 255 <
ffff8d4c469776c0 2288692830 C Ci:1:022:0 0 40 = 28035300 74006500 65006c00 53006500 72006900 65007300 20004700 61006d00
ffff8d4c51807600 2289635579 S Ci:1:022:0 s 80 06 0100 0000 0008 8 <
ffff8d4c51807600 2289635757 C Ci:1:022:0 0 8 = 12010002 00000040
ffff8d4c48c1ab40 2289636048 S Ci:1:022:0 s 80 06 0100 0000 0012 18 <
ffff8d4c48c1ab40 2289636219 C Ci:1:022:0 0 18 = 12010002 00000040 38108012 40010102 0001
ffff8d4b03ec99c0 2289636469 S Ci:1:022:0 s 80 06 0200 0000 0008 8 <
ffff8d4b03ec99c0 2289636653 C Ci:1:022:0 0 8 = 09025400 03010080
ffff8d4c43d86480 2289636755 S Ci:1:022:0 s 80 06 0200 0000 0054 84 <
ffff8d4c43d86480 2289636981 C Ci:1:022:0 0 84 = 09025400 03010080 32090400 00010300 00000921 11010001 22220007 05810340
ffff8d4c275703c0 2289637102 S Ci:1:022:0 s 80 06 0300 0000 0002 2 <
ffff8d4c275703c0 2289637256 C Ci:1:022:0 0 2 = 0403
ffff8d4f610d6c00 2289637398 S Ci:1:022:0 s 80 06 0300 0000 0004 4 <
ffff8d4f610d6c00 2289637583 C Ci:1:022:0 0 4 = 04030904
ffff8d4b29e0e780 2292637073 S Ci:1:022:0 s 80 06 0100 0000 0012 18 <
ffff8d4b29e0e780 2292637290 C Ci:1:022:0 0 18 = 12010002 00000040 38108012 40010102 0001
ffff8d4b29e0e780 2292637355 S Ci:1:022:0 s 80 06 0200 0000 0054 84 <
ffff8d4b29e0e780 2292637595 C Ci:1:022:0 0 84 = 09025400 03010080 32090400 00010300 00000921 11010001 22220007 05810340
ffff8d4b29e0e780 2292638619 S Co:1:022:0 s 00 09 0001 0000 0000 0
ffff8d4b29e0e780 2292638789 C Co:1:022:0 0 0
ffff8d4b29e0e780 2292680406 S Ci:1:022:0 s 80 06 0100 0000 0040 64 <
ffff8d4b29e0e780 2292680589 C Ci:1:022:0 0 18 = 12010002 00000040 38108012 40010102 0001
ffff8d4c48482300 2292723769 S Ci:1:022:0 s 80 06 0100 0000 0012 18 <
ffff8d4c48482300 2292723968 C Ci:1:022:0 0 18 = 12010002 00000040 38108012 40010102 0001
ffff8d4c4b990780 2292728105 S Ci:1:022:0 s 80 06 0200 0000 00ff 255 <
ffff8d4c4b990780 2292728350 C Ci:1:022:0 0 84 = 09025400 03010080 32090400 00010300 00000921 11010001 22220007 05810340
ffff8d4b1ecc7540 2292728461 S Ci:1:022:0 s 80 06 0300 0000 00ff 255 <
ffff8d4b1ecc7540 2292728670 C Ci:1:022:0 0 4 = 04030904
ffff8d4c51942300 2292728807 S Ci:1:022:0 s 80 06 0302 0409 00ff 255 <
ffff8d4c51942300 2292728971 C Ci:1:022:0 0 40 = 28035300 74006500 65006c00 53006500 72006900 65007300 20004700 61006d00
ffff8d4b50e1bb40 2292729051 S Ci:1:022:0 s 80 06 0600 0000 000a 10 <
ffff8d4b50e1bb40 2292729189 C Ci:1:022:0 -32 0
ffff8d4b5bf2e900 2292740461 S Ci:1:022:0 s 80 06 0100 0000 0012 18 <
ffff8d4b5bf2e900 2292740688 C Ci:1:022:0 0 18 = 12010002 00000040 38108012 40010102 0001
ffff8d4bf53e9240 2292740837 S Ci:1:022:0 s 80 06 0200 0000 0009 9 <
ffff8d4bf53e9240 2292740968 C Ci:1:022:0 0 9 = 09025400 03010080 32
ffff8d4c500bf540 2292741040 S Ci:1:022:0 s 80 06 0200 0000 0054 84 <
ffff8d4c500bf540 2292741265 C Ci:1:022:0 0 84 = 09025400 03010080 32090400 00010300 00000921 11010001 22220007 05810340
ffff8d4b673b7300 2292744067 S Ci:1:022:0 s 80 06 0302 0409 0004 4 <
ffff8d4b673b7300 2292744199 C Ci:1:022:0 0 4 = 28035300
ffff8d4c500be900 2292744383 S Ci:1:022:0 s 80 06 0302 0409 0028 40 <
ffff8d4c500be900 2292744593 C Ci:1:022:0 0 40 = 28035300 74006500 65006c00 53006500 72006900 65007300 20004700 61006d00
ffff8d4c500bf540 2292745773 S Ci:1:022:0 s 80 06 0302 0409 0004 4 <
ffff8d4c500bf540 2292745902 C Ci:1:022:0 0 4 = 28035300
ffff8d4edbb4e240 2292745974 S Ci:1:022:0 s 80 06 0302 0409 0028 40 <
ffff8d4edbb4e240 2292746124 C Ci:1:022:0 0 40 = 28035300 74006500 65006c00 53006500 72006900 65007300 20004700 61006d00
ffff8d4cdbc5fcc0 2292746999 S Ci:1:022:0 s 80 06 0302 0409 0004 4 <
ffff8d4cdbc5fcc0 2292747131 C Ci:1:022:0 0 4 = 28035300
ffff8d4cdbc5f9c0 2292747234 S Ci:1:022:0 s 80 06 0302 0409 0028 40 <
ffff8d4cdbc5f9c0 2292747403 C Ci:1:022:0 0 40 = 28035300 74006500 65006c00 53006500 72006900 65007300 20004700 61006d00
ffff8d4bf53e9240 2292748879 S Co:1:022:0 s 21 0a 0000 0000 0000 0
ffff8d4bf53e9240 2292748937 C Co:1:022:0 0 0
ffff8d4d169eaa80 2292749113 S Ci:1:022:0 s 81 06 2200 0000 0062 98 <
ffff8d4d169eaa80 2292749280 C Ci:1:022:0 0 34 = 06c0ff09 01a10109 f0150026 ff007508 95408102 09f19540 910209f2 960004b1
ffff8d4b5bf2e900 2292752227 S Co:1:022:0 s 21 0a 0000 0001 0000 0
ffff8d4b5bf2e900 2292752333 C Co:1:022:0 0 0
ffff8d4b505e5780 2292752608 S Ci:1:022:0 s 81 06 2200 0001 0057 87 <
ffff8d4b505e5780 2292752747 C Ci:1:022:0 0 23 = 050c0901 a1011900 2aff0f15 0026ff0f 75109502 8100c0
ffff8d4b505e5780 2292754149 S Ii:1:022:1 -115:8 64 <
ffff8d4b50e1bb40 2292755468 S Co:1:022:0 s 21 0a 0000 0002 0000 0
ffff8d4b50e1bb40 2292755599 C Co:1:022:0 0 0
ffff8d4c51942300 2292755885 S Ci:1:022:0 s 81 06 2200 0002 0055 85 <
ffff8d4c51942300 2292756077 C Ci:1:022:0 0 21 = 06c1ff09 01a10109 f0150026 ff007508 95408102 c0
ffff8d4b50e1af00 2292758103 S Ii:1:022:3 -115:4 64 <
ffff8d4c51942300 2292762150 S Ii:1:022:2 -115:8 4 <
ffff8d4b50e1af00 2295827672 C Ii:1:022:3 0:4 64 = b0010302 00000000 00000000 00000000 00000000 00000000 00000000 00000000
ffff8d4b50e1af00 2295827745 S Ii:1:022:3 -115:4 64 <
ffff8d4dfa89ba80 2333465255 S Ci:1:022:0 s 80 06 0302 0409 0082 130 <
ffff8d4dfa89ba80 2333465445 C Ci:1:022:0 0 40 = 28035300 74006500 65006c00 53006500 72006900 65007300 20004700 61006d00
ffff8d4cf8f2a000 2333528158 S Ci:1:022:0 s 80 06 0302 0409 0082 130 <
ffff8d4cf8f2a000 2333528365 C Ci:1:022:0 0 40 = 28035300 74006500 65006c00 53006500 72006900 65007300 20004700 61006d00
ffff8d4c4ec3aa80 2333528581 S Ci:1:022:0 s 80 06 0302 0409 0082 130 <
ffff8d4c4ec3aa80 2333528747 C Ci:1:022:0 0 40 = 28035300 74006500 65006c00 53006500 72006900 65007300 20004700 61006d00
ffff8d4cd9970a80 2338544341 S Co:1:022:0 s 21 09 0200 0000 0040 64 = 10000000 00000000 00000000 00000000 00000000 00000000 00000000 00000000
ffff8d4cd9970a80 2338544528 C Co:1:022:0 0 64 >
ffff8d4b505e5780 2338547462 C Ii:1:022:1 0:8 64 = 10040000 005b0000 00270000 002c0000 00010000 00280000 00000000 00cef976
ffff8d4b505e5780 2338547536 S Ii:1:022:1 -115:8 64 <
ffff8d4c4d0689c0 2338614040 S Co:1:022:0 s 21 09 0200 0000 0040 64 = 10000000 00000000 00000000 00000000 00000000 00000000 00000000 00000000
ffff8d4c4d0689c0 2338614233 C Co:1:022:0 0 64 >
ffff8d4b505e5780 2338619464 C Ii:1:022:1 0:8 64 = 10040000 005b0000 00270000 002c0000 00010000 00280000 00000000 00cef976
ffff8d4b505e5780 2338619530 S Ii:1:022:1 -115:8 64 <
ffff8d4b673b7300 2338676784 S Co:1:022:0 s 21 09 0200 0000 0040 64 = 10000000 00000000 00000000 00000000 00000000 00000000 00000000 00000000
ffff8d4b673b7300 2338676968 C Co:1:022:0 0 64 >
ffff8d4b505e5780 2338683461 C Ii:1:022:1 0:8 64 = 10040000 005b0000 00270000 002c0000 00010000 00280000 00000000 00cef976
ffff8d4b505e5780 2338683567 S Ii:1:022:1 -115:8 64 <
ffff8d4c4d0689c0 2338736961 S Co:1:022:0 s 21 09 0200 0000 0040 64 = 2c000000 00000000 00000000 00000000 00000000 00000000 00000000 00000000
ffff8d4c4d0689c0 2338737142 C Co:1:022:0 0 64 >
ffff8d4c500b9780 2339249740 S Co:1:022:0 s 21 09 0200 0000 0040 64 = 20000000 00000000 00000000 00000000 00000000 00000000 00000000 00000000
ffff8d4c500b9780 2339249919 C Co:1:022:0 0 64 >
ffff8d4b505e5780 2339251463 C Ii:1:022:1 0:8 64 = 20012c01 14010000 00000000 00000000 00000000 00000000 00000000 00000000
ffff8d4b505e5780 2339251513 S Ii:1:022:1 -115:8 64 <
ffff8d4d8359f900 2339336143 S Co:1:022:0 s 21 09 0200 0000 0040 64 = a0000000 00000000 00000000 00000000 00000000 00000000 00000000 00000000
ffff8d4d8359f900 2339336341 C Co:1:022:0 0 64 >
ffff8d4b505e5780 2339339460 C Ii:1:022:1 0:8 64 = a00a0a00 0a000000 00000000 00000000 00000000 00000000 00000000 00000000
ffff8d4b505e5780 2339339505 S Ii:1:022:1 -115:8 64 <
ffff8d4ce106a480 2339438252 S Co:1:022:0 s 21 09 0200 0000 0040 64 = 80000000 00000000 00000000 00000000 00000000 00000000 00000000 00000000
ffff8d4ce106a480 2339438507 C Co:1:022:0 0 64 >
ffff8d4b505e5780 2339443463 C Ii:1:022:1 0:8 64 = 80c02709 00c01000 00000000 00000000 00000000 00000000 00000000 00000000
ffff8d4b505e5780 2339443522 S Ii:1:022:1 -115:8 64 <
ffff8d4bdb360c00 2339885223 S Co:1:022:0 s 21 09 0200 0000 0040 64 = 10000000 00000000 00000000 00000000 00000000 00000000 00000000 00000000
ffff8d4bdb360c00 2339885487 C Co:1:022:0 0 64 >
ffff8d4b505e5780 2339891466 C Ii:1:022:1 0:8 64 = 10040000 005b0000 00270000 002c0000 00010000 00280000 00000000 00cef976
ffff8d4b505e5780 2339891563 S Ii:1:022:1 -115:8 64 <
ffff8d4b235fa6c0 2340067132 S Co:1:022:0 s 21 09 0200 0000 0040 64 = 37000000 00000000 00000000 00000000 00000000 00000000 00000000 00000000
ffff8d4b235fa6c0 2340067371 C Co:1:022:0 0 64 >
ffff8d4b09cdf300 2340139089 S Co:1:022:0 s 21 09 0300 0000 0400 1024 = aa000000 ffff32c8 c8000001 00000000 00000000 00000000 00000000 00000000
ffff8d4b09cdf300 2340141526 C Co:1:022:0 0 1024 >
ffff8d4bf6ae03c0 2340207704 S Co:1:022:0 s 21 09 0200 0000 0040 64 = 2a010000 00000000 00000000 00000000 00000000 00000000 00000000 00000000
ffff8d4bf6ae03c0 2340207881 C Co:1:022:0 0 64 >
ffff8d4c51942480 2340267889 S Co:1:022:0 s 21 09 0200 0000 0040 64 = 47000000 00000000 00000000 00000000 00000000 00000000 00000000 00000000
ffff8d4c51942480 2340268127 C Co:1:022:0 0 64 >
ffff8d4c500b9780 2340330807 S Co:1:022:0 s 21 09 0200 0000 0040 64 = 39010000 00000000 00000000 00000000 00000000 00000000 00000000 00000000
ffff8d4c500b9780 2340330994 C Co:1:022:0 0 64 >
ffff8d4c500bf540 2340393596 S Co:1:022:0 s 21 09 0200 0000 0040 64 = a5040000 00000000 00000000 00000000 00000000 00000000 00000000 00000000
ffff8d4c500bf540 2340393771 C Co:1:022:0 0 64 >
ffff8d4c508d03c0 2340456567 S Co:1:022:0 s 21 09 0200 0000 0040 64 = 2e000000 00000000 00000000 00000000 00000000 00000000 00000000 00000000
ffff8d4c508d03c0 2340456746 C Co:1:022:0 0 64 >
ffff8d4ce1e00240 2340536391 S Co:1:022:0 s 21 09 0300 0000 0400 1024 = aa03ff00 00ff32c8 c8000301 00000000 00000000 00000000 00000000 00000000
ffff8d4ce1e00240 2340539242 C Co:1:022:0 0 1024 >
ffff8d4c519d6840 2340598670 S Co:1:022:0 s 21 09 0200 0000 0040 64 = 83c02709 00000000 00000000 00000000 00000000 00000000 00000000 00000000
ffff8d4c519d6840 2340598846 C Co:1:022:0 0 64 >
ffff8d4c0f50b180 2340661924 S Co:1:022:0 s 21 09 0200 0000 0040 64 = 33000000 00000000 00000000 00000000 00000000 00000000 00000000 00000000
ffff8d4c0f50b180 2340662130 C Co:1:022:0 0 64 >
ffff8d4c47fa8480 2340742457 S Co:1:022:0 s 21 09 0300 0000 0400 1024 = aa010000 ffff32c8 c8000101 00000000 00000000 00000000 00000000 00000000
ffff8d4c47fa8480 2340745067 C Co:1:022:0 0 1024 >
ffff8d4c47fa8480 2340805741 S Co:1:022:0 s 21 09 0200 0000 0040 64 = a5080a00 00000000 00000000 00000000 00000000 00000000 00000000 00000000
ffff8d4c47fa8480 2340805925 C Co:1:022:0 0 64 >
ffff8d4b673b7300 2340869963 S Co:1:022:0 s 21 09 0200 0000 0040 64 = a5030a00 00000000 00000000 00000000 00000000 00000000 00000000 00000000
ffff8d4b673b7300 2340870176 C Co:1:022:0 0 64 >
ffff8d4b673b7300 2340933313 S Co:1:022:0 s 21 09 0200 0000 0040 64 = 85c00000 00000000 00000000 00000000 00000000 00000000 00000000 00000000
ffff8d4b673b7300 2340933500 C Co:1:022:0 0 64 >
ffff8d4b673b7300 2340996264 S Co:1:022:0 s 21 09 0300 0000 0400 1024 = aa020000 00ff32c8 c8000201 00000000 00000000 00000000 00000000 00000000
ffff8d4b673b7300 2340999087 C Co:1:022:0 0 1024 >
ffff8d4c47fa8480 2341060367 S Co:1:022:0 s 21 09 0200 0000 0040 64 = 43010000 00000000 00000000 00000000 00000000 00000000 00000000 00000000
ffff8d4c47fa8480 2341060561 C Co:1:022:0 0 64 >
ffff8d4b0b4a06c0 2341112764 S Co:1:022:0 s 21 09 0200 0000 0040 64 = 27010000 00000000 00000000 00000000 00000000 00000000 00000000 00000000
ffff8d4b0b4a06c0 2341112950 C Co:1:022:0 0 64 >
ffff8d4b29f69e40 2341171466 S Co:1:022:0 s 21 09 0200 0000 0040 64 = a5040000 00000000 00000000 00000000 00000000 00000000 00000000 00000000
ffff8d4b29f69e40 2341171652 C Co:1:022:0 0 64 >
ffff8d4cd9970a80 2341235414 S Co:1:022:0 s 21 09 0200 0000 0040 64 = a5080a00 00000000 00000000 00000000 00000000 00000000 00000000 00000000
ffff8d4cd9970a80 2341235646 C Co:1:022:0 0 64 >
ffff8d4c4d068f00 2341299437 S Co:1:022:0 s 21 09 0200 0000 0040 64 = a5030a00 00000000 00000000 00000000 00000000 00000000 00000000 00000000
ffff8d4c4d068f00 2341299649 C Co:1:022:0 0 64 >
ffff8d4b1ecc7540 2341363179 S Co:1:022:0 s 21 09 0200 0000 0040 64 = ac000000 00000000 00000000 00000000 00000000 00000000 00000000 00000000
ffff8d4b1ecc7540 2341363378 C Co:1:022:0 0 64 >
ffff8d4c4e5bcf00 2341413817 S Co:1:022:0 s 21 09 0200 0000 0040 64 = 09000000 00000000 00000000 00000000 00000000 00000000 00000000 00000000
ffff8d4c4e5bcf00 2341413990 C Co:1:022:0 0 64 >
ffff8d4b5bf98600 2351893701 S Co:1:022:0 s 21 09 0200 0000 0040 64 = 10000000 00000000 00000000 00000000 00000000 00000000 00000000 00000000
ffff8d4b5bf98600 2351893881 C Co:1:022:0 0 64 >
ffff8d4b505e5780 2351899441 C Ii:1:022:1 0:8 64 = 10040000 005b0000 00270000 002c0000 00010000 00280000 00000000 00cef976
ffff8d4b505e5780 2351899518 S Ii:1:022:1 -115:8 64 <
ffff8d4b17d826c0 2352060475 S Co:1:022:0 s 21 09 0200 0000 0040 64 = 20000000 00000000 00000000 00000000 00000000 00000000 00000000 00000000
ffff8d4b17d826c0 2352060697 C Co:1:022:0 0 64 >
ffff8d4b505e5780 2352067469 C Ii:1:022:1 0:8 64 = 20012c01 14010000 00000000 00000000 00000000 00000000 00000000 00000000
ffff8d4b505e5780 2352067521 S Ii:1:022:1 -115:8 64 <
ffff8d4f610d5300 2357794445 S Co:1:022:0 s 21 09 0200 0000 0040 64 = a3000000 00000000 00000000 00000000 00000000 00000000 00000000 00000000
ffff8d4f610d5300 2357794629 C Co:1:022:0 0 64 >
ffff8d4c4bbec540 2357855421 S Co:1:022:0 s 21 09 0300 0000 0400 1024 = aa00ff3c 00ff32c8 c8000000 0016eb00 a8000100 e8fe1800 a8000200 17eefe00
ffff8d4c4bbec540 2357858378 C Co:1:022:0 0 1024 >
ffff8d4b4e9e2240 2357922287 S Co:1:022:0 s 21 09 0300 0000 0400 1024 = aa01ff3c 00ff32c8 c8000100 0016eb00 a8000100 e8fe1800 a8000200 17eefe00
ffff8d4b4e9e2240 2357924841 C Co:1:022:0 0 1024 >
ffff8d4cdbc5f540 2357987065 S Co:1:022:0 s 21 09 0200 0000 0040 64 = a5030a00 00000000 00000000 00000000 00000000 00000000 00000000 00000000
ffff8d4cdbc5f540 2357987356 C Co:1:022:0 0 64 >
ffff8d4c4d64e240 2358041483 S Co:1:022:0 s 21 09 0200 0000 0040 64 = a3000000 00000000 00000000 00000000 00000000 00000000 00000000 00000000
ffff8d4c4d64e240 2358041718 C Co:1:022:0 0 64 >
ffff8d4b03ec1780 2391952079 S Co:1:022:0 s 21 09 0300 0000 0400 1024 = aa011234 56ff32c8 c8000100 0016eb00 a8000100 e8fe1800 a8000200 17eefe00
ffff8d4b03ec1780 2391954856 C Co:1:022:0 0 1024 >
ffff8d4b2a253c00 2392016972 S Co:1:022:0 s 21 09 0200 0000 0040 64 = a5030a00 00000000 00000000 00000000 00000000 00000000 00000000 00000000
ffff8d4b2a253c00 2392017169 C Co:1:022:0 0 64 >
ffff8d4b66c949c0 2392071363 S Co:1:022:0 s 21 09 0200 0000 0040 64 = a3000000 00000000 00000000 00000000 00000000 00000000 00000000 00000000
ffff8d4b66c949c0 2392071579 C Co:1:022:0 0 64 >
ffff8d4cd9971b40 2402456417 S Co:1:022:0 s 21 09 0300 0000 0400 1024 = aa001234 56ff32c8 c8000000 0016eb00 a8000100 e8fe1800 a8000200 17eefe00
ffff8d4cd9971b40 2402459294 C Co:1:022:0 0 1024 >
ffff8d4c4e5bc900 2402515363 S Co:1:022:0 s 21 09 0200 0000 0040 64 = a5030a00 00000000 00000000 00000000 00000000 00000000 00000000 00000000
ffff8d4c4e5bc900 2402515539 C Co:1:022:0 0 64 >
ffff8d4cdb132300 2402569940 S Co:1:022:0 s 21 09 0200 0000 0040 64 = a3000000 00000000 00000000 00000000 00000000 00000000 00000000 00000000
ffff8d4cdb132300 2402570116 C Co:1:022:0 0 64 >
ffff8d4b0b574180 2403580024 S Co:1:022:0 s 21 09 0200 0000 0040 64 = ac000000 00000000 00000000 00000000 00000000 00000000 00000000 00000000
ffff8d4b0b574180 2403580237 C Co:1:022:0 0 64 >
ffff8d4cdd7f36c0 2403642072 S Co:1:022:0 s 21 09 0200 0000 0040 64 = 09000000 00000000 00000000 00000000 00000000 00000000 00000000 00000000
ffff8d4cdd7f36c0 2403642333 C Co:1:022:0 0 64 >
ffff8d4b03ef6300 2417553994 S Co:1:022:0 s 21 09 0200 0000 0040 64 = a3000000 00000000 00000000 00000000 00000000 00000000 00000000 00000000
ffff8d4b03ef6300 2417554196 C Co:1:022:0 0 64 >
ffff8d4cdbc5f3c0 2417615252 S Co:1:022:0 s 21 09 0300 0000 0400 1024 = aa00ff3c 00ff32c8 c8000000 0016eb00 a8000100 e8fe1800 a8000200 17eefe00
ffff8d4cdbc5f3c0 2417617879 C Co:1:022:0 0 1024 >
ffff8d4bfeb44d80 2417673138 S Co:1:022:0 s 21 09 0300 0000 0400 1024 = aa01ff3c 00ff32c8 c8000100 0016eb00 a8000100 e8fe1800 a8000200 17eefe00
ffff8d4bfeb44d80 2417675775 C Co:1:022:0 0 1024 >
ffff8d4bdb3600c0 2417735665 S Co:1:022:0 s 21 09 0200 0000 0040 64 = a5030a00 00000000 00000000 00000000 00000000 00000000 00000000 00000000
ffff8d4bdb3600c0 2417735885 C Co:1:022:0 0 64 >
ffff8d4c4ef74c00 2417791264 S Co:1:022:0 s 21 09 0200 0000 0040 64 = a3000000 00000000 00000000 00000000 00000000 00000000 00000000 00000000
ffff8d4c4ef74c00 2417791486 C Co:1:022:0 0 64 >
ffff8d4c4ec3a3c0 2423599139 S Co:1:022:0 s 21 09 0300 0000 0400 1024 = aa001234 56ff32c8 c8000000 0016eb00 a8000100 e8fe1800 a8000200 17eefe00
ffff8d4c4ec3a3c0 2423601857 C Co:1:022:0 0 1024 >
ffff8d4b039cecc0 2423660665 S Co:1:022:0 s 21 09 0300 0000 0400 1024 = aa011234 56ff32c8 c8000100 0016eb00 a8000100 e8fe1800 a8000200 17eefe00
ffff8d4b039cecc0 2423663342 C Co:1:022:0 0 1024 >
ffff8d4bdb360d80 2423723081 S Co:1:022:0 s 21 09 0200 0000 0040 64 = a5030a00 00000000 00000000 00000000 00000000 00000000 00000000 00000000
ffff8d4bdb360d80 2423723322 C Co:1:022:0 0 64 >
ffff8d4c4ef74c00 2423785239 S Co:1:022:0 s 21 09 0200 0000 0040 64 = ac000000 00000000 00000000 00000000 00000000 00000000 00000000 00000000
ffff8d4c4ef74c00 2423785418 C Co:1:022:0 0 64 >
ffff8d4c4f0f7900 2423847904 S Co:1:022:0 s 21 09 0200 0000 0040 64 = 09000000 00000000 00000000 00000000 00000000 00000000 00000000 00000000
ffff8d4c4f0f7900 2423848208 C Co:1:022:0 0 64 >
ffff8d4cdbc5f000 2453299939 S Co:1:022:0 s 21 09 0300 0000 0400 1024 = aa000000 00ff32c8 c8000000 0016eb00 a8000100 e8fe1800 a8000200 17eefe00
ffff8d4cdbc5f000 2453302797 C Co:1:022:0 0 1024 >
ffff8d4b50e1a6c0 2453361325 S Co:1:022:0 s 21 09 0300 0000 0400 1024 = aa010000 00ff32c8 c8000100 0016eb00 a8000100 e8fe1800 a8000200 17eefe00
ffff8d4b50e1a6c0 2453364066 C Co:1:022:0 0 1024 >
ffff8d4c48ff1a80 2453425141 S Co:1:022:0 s 21 09 0200 0000 0040 64 = a5030a00 00000000 00000000 00000000 00000000 00000000 00000000 00000000
ffff8d4c48ff1a80 2453425371 C Co:1:022:0 0 64 >
ffff8d4c469779c0 2453488563 S Co:1:022:0 s 21 09 0200 0000 0040 64 = ac000000 00000000 00000000 00000000 00000000 00000000 00000000 00000000
ffff8d4c469779c0 2453488810 C Co:1:022:0 0 64 >
ffff8d4c500bbd80 2453552130 S Co:1:022:0 s 21 09 0200 0000 0040 64 = 09000000 00000000 00000000 00000000 00000000 00000000 00000000 00000000
ffff8d4c500bbd80 2453552318 C Co:1:022:0 0 64 >
ffff8d4b1a21e0c0 2477055189 S Co:1:022:0 s 21 09 0300 0000 0400 1024 = aa001234 56ff32c8 c8000000 0016eb00 a8000100 e8fe1800 a8000200 17eefe00
ffff8d4b1a21e0c0 2477057979 C Co:1:022:0 0 1024 >
ffff8d4bb4286f00 2477109321 S Co:1:022:0 s 21 09 0300 0000 0400 1024 = aa011234 56ff32c8 c8000100 0016eb00 a8000100 e8fe1800 a8000200 17eefe00
ffff8d4bb4286f00 2477112340 C Co:1:022:0 0 1024 >
ffff8d4c500b7480 2477173055 S Co:1:022:0 s 21 09 0200 0000 0040 64 = a5030a00 00000000 00000000 00000000 00000000 00000000 00000000 00000000
ffff8d4c500b7480 2477173238 C Co:1:022:0 0 64 >
ffff8d4b1ecc7480 2477236214 S Co:1:022:0 s 21 09 0200 0000 0040 64 = ac000000 00000000 00000000 00000000 00000000 00000000 00000000 00000000
ffff8d4b1ecc7480 2477236398 C Co:1:022:0 0 64 >
ffff8d4cdb359180 2477298988 S Co:1:022:0 s 21 09 0200 0000 0040 64 = 09000000 00000000 00000000 00000000 00000000 00000000 00000000 00000000
ffff8d4cdb359180 2477299170 C Co:1:022:0 0 64 >
ffff8d4b50e1a9c0 2490939059 S Co:1:022:0 s 21 09 0300 0000 0400 1024 = aa000000 00ff32c8 c8000001 00000000 00000000 00000000 00000000 00000000
ffff8d4b50e1a9c0 2490941821 C Co:1:022:0 0 1024 >
ffff8d4c4a6c5180 2491001953 S Co:1:022:0 s 21 09 0300 0000 0400 1024 = aa010000 00ff32c8 c8000101 00000000 00000000 00000000 00000000 00000000
ffff8d4c4a6c5180 2491004475 C Co:1:022:0 0 1024 >
ffff8d4c4108d3c0 2491066034 S Co:1:022:0 s 21 09 0200 0000 0040 64 = a5030a00 00000000 00000000 00000000 00000000 00000000 00000000 00000000
ffff8d4c4108d3c0 2491066215 C Co:1:022:0 0 64 >
ffff8d4bf53e9f00 2491129499 S Co:1:022:0 s 21 09 0200 0000 0040 64 = ac000000 00000000 00000000 00000000 00000000 00000000 00000000 00000000
ffff8d4bf53e9f00 2491129775 C Co:1:022:0 0 64 >
ffff8d4c4e5bca80 2491191903 S Co:1:022:0 s 21 09 0200 0000 0040 64 = 09000000 00000000 00000000 00000000 00000000 00000000 00000000 00000000
ffff8d4c4e5bca80 2491192091 C Co:1:022:0 0 64 >
ffff8d4c4ba27540 2524614109 S Co:1:022:0 s 21 09 0300 0000 0400 1024 = aa00ff3c 00ff32c8 c8000000 fffdfb00 fa000100 01030500 fa000000 00000000
ffff8d4c4ba27540 2524616818 C Co:1:022:0 0 1024 >
ffff8d4d169eae40 2524673263 S Co:1:022:0 s 21 09 0300 0000 0400 1024 = aa01ff3c 00ff32c8 c8000100 fffdfb00 fa000100 01030500 fa000000 00000000
ffff8d4d169eae40 2524675911 C Co:1:022:0 0 1024 >
ffff8d4b504d09c0 2524727299 S Co:1:022:0 s 21 09 0200 0000 0040 64 = a5030a00 00000000 00000000 00000000 00000000 00000000 00000000 00000000
ffff8d4b504d09c0 2524727516 C Co:1:022:0 0 64 >
ffff8d4b5bf2ee40 2524783780 S Co:1:022:0 s 21 09 0200 0000 0040 64 = ac000000 00000000 00000000 00000000 00000000 00000000 00000000 00000000
ffff8d4b5bf2ee40 2524783968 C Co:1:022:0 0 64 >
ffff8d4d20a0f300 2524845859 S Co:1:022:0 s 21 09 0200 0000 0040 64 = 09000000 00000000 00000000 00000000 00000000 00000000 00000000 00000000
ffff8d4d20a0f300 2524846072 C Co:1:022:0 0 64 >
ffff8d4b50e1aa80 2552144923 S Co:1:022:0 s 21 09 0300 0000 0400 1024 = aa00ff3c 00ff32c8 c8000000 00ffff00 ee020100 00010100 ee020000 00000000
ffff8d4b50e1aa80 2552147330 C Co:1:022:0 0 1024 >
ffff8d4c508d09c0 2552202897 S Co:1:022:0 s 21 09 0300 0000 0400 1024 = aa01ff3c 00ff32c8 c8000100 00ffff00 ee020100 00010100 ee020000 00000000
ffff8d4c508d09c0 2552205699 C Co:1:022:0 0 1024 >
ffff8d4edbb4e240 2552267321 S Co:1:022:0 s 21 09 0200 0000 0040 64 = a5030a00 00000000 00000000 00000000 00000000 00000000 00000000 00000000
ffff8d4edbb4e240 2552267549 C Co:1:022:0 0 64 >
ffff8d4b0b575c00 2552331223 S Co:1:022:0 s 21 09 0200 0000 0040 64 = ac000000 00000000 00000000 00000000 00000000 00000000 00000000 00000000
ffff8d4b0b575c00 2552331492 C Co:1:022:0 0 64 >
ffff8d4b0ae7d540 2552395339 S Co:1:022:0 s 21 09 0200 0000 0040 64 = 09000000 00000000 00000000 00000000 00000000 00000000 00000000 00000000
ffff8d4b0ae7d540 2552395641 C Co:1:022:0 0 64 >
ffff8d4cd9971a80 2571482773 S Co:1:022:0 s 21 09 0300 0000 0400 1024 = aa00ff3c 00ff32c8 c8000000 0000ff00 e2040100 00000100 e2040000 00000000
ffff8d4cd9971a80 2571485741 C Co:1:022:0 0 1024 >
ffff8d4b0ae7d600 2571548222 S Co:1:022:0 s 21 09 0300 0000 0400 1024 = aa01ff3c 00ff32c8 c8000100 0000ff00 e2040100 00000100 e2040000 00000000
ffff8d4b0ae7d600 2571550986 C Co:1:022:0 0 1024 >
ffff8d4c53a81540 2571611110 S Co:1:022:0 s 21 09 0200 0000 0040 64 = a5030a00 00000000 00000000 00000000 00000000 00000000 00000000 00000000
ffff8d4c53a81540 2571611331 C Co:1:022:0 0 64 >
ffff8d4c4f29ecc0 2571675153 S Co:1:022:0 s 21 09 0200 0000 0040 64 = ac000000 00000000 00000000 00000000 00000000 00000000 00000000 00000000
ffff8d4c4f29ecc0 2571675435 C Co:1:022:0 0 64 >
ffff8d4c401af900 2571737992 S Co:1:022:0 s 21 09 0200 0000 0040 64 = 09000000 00000000 00000000 00000000 00000000 00000000 00000000 00000000
ffff8d4c401af900 2571738216 C Co:1:022:0 0 64 >
ffff8d4c51d1a000 2611162224 S Co:1:022:0 s 21 09 0300 0000 0400 1024 = aa00ff3c 00ff32c8 c8000000 b2aaa200 21000100 4e565e00 21000000 00000000
ffff8d4c51d1a000 2611164662 C Co:1:022:0 0 1024 >
ffff8d4c4bbec540 2611223329 S Co:1:022:0 s 21 09 0300 0000 0400 1024 = aa01ff3c 00ff32c8 c8000100 b2aaa200 21000100 4e565e00 21000000 00000000
ffff8d4c4bbec540 2611226104 C Co:1:022:0 0 1024 >
ffff8d4c47e173c0 2611287213 S Co:1:022:0 s 21 09 0200 0000 0040 64 = a5030a00 00000000 00000000 00000000 00000000 00000000 00000000 00000000
ffff8d4c47e173c0 2611287430 C Co:1:022:0 0 64 >
ffff8d4c27b9b900 2611351301 S Co:1:022:0 s 21 09 0200 0000 0040 64 = ac000000 00000000 00000000 00000000 00000000 00000000 00000000 00000000
ffff8d4c27b9b900 2611351488 C Co:1:022:0 0 64 >
ffff8d4c40fc4840 2611415812 S Co:1:022:0 s 21 09 0200 0000 0040 64 = 09000000 00000000 00000000 00000000 00000000 00000000 00000000 00000000
ffff8d4c40fc4840 2611415991 C Co:1:022:0 0 64 >
ffff8d4b55dfecc0 2666047948 S Co:1:022:0 s 21 09 0300 0000 0400 1024 = aa00ff3c 00ff32c8 c8000000 0705fe00 a3000100 0b0b1800 5b000200 f3020400
ffff8d4b55dfecc0 2666050525 C Co:1:022:0 0 1024 >
ffff8d4c0f501e40 2666109837 S Co:1:022:0 s 21 09 0300 0000 0400 1024 = aa01ff3c 00ff32c8 c8000100 0705fe00 a3000100 0b0b1800 5b000200 f3020400
ffff8d4c0f501e40 2666112741 C Co:1:022:0 0 1024 >
ffff8d4c401af840 2666173069 S Co:1:022:0 s 21 09 0200 0000 0040 64 = a5030a00 00000000 00000000 00000000 00000000 00000000 00000000 00000000
ffff8d4c401af840 2666173251 C Co:1:022:0 0 64 >
ffff8d4b50e1b240 2666235644 S Co:1:022:0 s 21 09 0200 0000 0040 64 = ac000000 00000000 00000000 00000000 00000000 00000000 00000000 00000000
ffff8d4b50e1b240 2666235866 C Co:1:022:0 0 64 >
ffff8d4c500b8e40 2666299263 S Co:1:022:0 s 21 09 0200 0000 0040 64 = 09000000 00000000 00000000 00000000 00000000 00000000 00000000 00000000
ffff8d4c500b8e40 2666299486 C Co:1:022:0 0 64 >
ffff8d4c25681a80 2680898687 S Co:1:022:0 s 21 09 0300 0000 0400 1024 = aa00ff3c 00ff32c8 c8000000 02020000 e0010100 03030800 0e010200 fc000100
ffff8d4c25681a80 2680901775 C Co:1:022:0 0 1024 >
ffff8d4c4ed0cf00 2680953214 S Co:1:022:0 s 21 09 0300 0000 0400 1024 = aa01ff3c 00ff32c8 c8000100 02020000 e0010100 03030800 0e010200 fc000100
ffff8d4c4ed0cf00 2680955689 C Co:1:022:0 0 1024 >
ffff8d4c4ec3af00 2681016973 S Co:1:022:0 s 21 09 0200 0000 0040 64 = a5030a00 00000000 00000000 00000000 00000000 00000000 00000000 00000000
ffff8d4c4ec3af00 2681017190 C Co:1:022:0 0 64 >
ffff8d4c4a6c5180 2681068655 S Co:1:022:0 s 21 09 0200 0000 0040 64 = ac000000 00000000 00000000 00000000 00000000 00000000 00000000 00000000
ffff8d4c4a6c5180 2681068832 C Co:1:022:0 0 64 >
ffff8d4c4ec6f480 2681126922 S Co:1:022:0 s 21 09 0200 0000 0040 64 = 09000000 00000000 00000000 00000000 00000000 00000000 00000000 00000000
ffff8d4c4ec6f480 2681127135 C Co:1:022:0 0 64 >
ffff8d4b2350ff00 2718424898 S Co:1:022:0 s 21 09 0300 0000 0400 1024 = aa00ff3c 00ff32c8 c8000000 05f30000 ff000100 fb0d0000 ff000000 00000000
ffff8d4b2350ff00 2718427235 C Co:1:022:0 0 1024 >
ffff8d4b01104780 2718484966 S Co:1:022:0 s 21 09 0300 0000 0400 1024 = aa01ff3c 00ff32c8 c8000100 00090000 ff000100 00f70000 ff000000 00000000
ffff8d4b01104780 2718487884 C Co:1:022:0 0 1024 >
ffff8d4d220a3840 2718547809 S Co:1:022:0 s 21 09 0200 0000 0040 64 = a5030a00 00000000 00000000 00000000 00000000 00000000 00000000 00000000
ffff8d4d220a3840 2718547983 C Co:1:022:0 0 64 >
ffff8d4c4d7f8a80 2718611287 S Co:1:022:0 s 21 09 0200 0000 0040 64 = ac000000 00000000 00000000 00000000 00000000 00000000 00000000 00000000
ffff8d4c4d7f8a80 2718611527 C Co:1:022:0 0 64 >
ffff8d4d1707c6c0 2718674923 S Co:1:022:0 s 21 09 0200 0000 0040 64 = 09000000 00000000 00000000 00000000 00000000 00000000 00000000 00000000
ffff8d4d1707c6c0 2718675154 C Co:1:022:0 0 64 >
ffff8d4bf53e9d80 2750320659 S Co:1:022:0 s 21 09 0300 0000 0400 1024 = aa00ff3c 00ff32c8 c8000000 00f8f000 fa000100 00081000 fa000000 00000000
ffff8d4bf53e9d80 2750323401 C Co:1:022:0 0 1024 >
ffff8d4cde10a000 2750375042 S Co:1:022:0 s 21 09 0300 0000 0400 1024 = aa01ff3c 00ff32c8 c8000100 f0fd0000 fa000100 10030000 fa000000 00000000
ffff8d4cde10a000 2750378090 C Co:1:022:0 0 1024 >
ffff8d4c4bbec540 2750438782 S Co:1:022:0 s 21 09 0200 0000 0040 64 = a5030a00 00000000 00000000 00000000 00000000 00000000 00000000 00000000
ffff8d4c4bbec540 2750439002 C Co:1:022:0 0 64 >
ffff8d4cd98d39c0 2750502955 S Co:1:022:0 s 21 09 0200 0000 0040 64 = ac000000 00000000 00000000 00000000 00000000 00000000 00000000 00000000
ffff8d4cd98d39c0 2750503144 C Co:1:022:0 0 64 >
ffff8d4bf53e86c0 2750566582 S Co:1:022:0 s 21 09 0200 0000 0040 64 = 09000000 00000000 00000000 00000000 00000000 00000000 00000000 00000000
ffff8d4bf53e86c0 2750566784 C Co:1:022:0 0 64 >
