ffff8d4c401af900 3418360813 S Co:1:022:0 s 21 09 0300 0000 0400 1024 = aa00ff00 00ff32c8 c8000001 00000000 00000000 00000000 00000000 00000000
ffff8d4c401af900 3418363748 C Co:1:022:0 0 1024 >
ffff8d4b50e1a600 3418425956 S Co:1:022:0 s 21 09 0300 0000 0400 1024 = aa010000 ffff32c8 c8000101 00000000 00000000 00000000 00000000 00000000
ffff8d4b50e1a600 3418428904 C Co:1:022:0 0 1024 >
ffff8d4c4e5bd840 3418489546 S Co:1:022:0 s 21 09 0200 0000 0040 64 = a5030a00 00000000 00000000 00000000 00000000 00000000 00000000 00000000
ffff8d4c4e5bd840 3418489726 C Co:1:022:0 0 64 >
ffff8d4cdb330540 3418553115 S Co:1:022:0 s 21 09 0200 0000 0040 64 = ac000000 00000000 00000000 00000000 00000000 00000000 00000000 00000000
ffff8d4cdb330540 3418553302 C Co:1:022:0 0 64 >
ffff8d4c4e5bd840 3418616848 S Co:1:022:0 s 21 09 0200 0000 0040 64 = 09000000 00000000 00000000 00000000 00000000 00000000 00000000 00000000
ffff8d4c4e5bd840 3418617027 C Co:1:022:0 0 64 >
ffff8d4b504d09c0 3429309740 S Co:1:022:0 s 21 09 0300 0000 0400 1024 = aa000000 ffff32c8 c8000001 00000000 00000000 00000000 00000000 00000000
ffff8d4b504d09c0 3429312410 C Co:1:022:0 0 1024 >
ffff8d4b50e1a600 3429363191 S Co:1:022:0 s 21 09 0300 0000 0400 1024 = aa01ff00 00ff32c8 c8000101 00000000 00000000 00000000 00000000 00000000
ffff8d4b50e1a600 3429366084 C Co:1:022:0 0 1024 >
ffff8d4b50e1a600 3429425878 S Co:1:022:0 s 21 09 0200 0000 0040 64 = a5030a00 00000000 00000000 00000000 00000000 00000000 00000000 00000000
ffff8d4b50e1a600 3429426096 C Co:1:022:0 0 64 >
ffff8d4b50e1a600 3429489296 S Co:1:022:0 s 21 09 0200 0000 0040 64 = ac000000 00000000 00000000 00000000 00000000 00000000 00000000 00000000
ffff8d4b50e1a600 3429489559 C Co:1:022:0 0 64 >
ffff8d4c4f20ccc0 3429553294 S Co:1:022:0 s 21 09 0200 0000 0040 64 = 09000000 00000000 00000000 00000000 00000000 00000000 00000000 00000000
ffff8d4c4f20ccc0 3429553513 C Co:1:022:0 0 64 >
ffff8d4d16bd9780 3457814154 S Co:1:022:0 s 21 09 0300 0000 0400 1024 = aa00ff3c 00ff32c8 c8000000 00ffff00 ee020100 00010100 ee020000 00000000
ffff8d4d16bd9780 3457816719 C Co:1:022:0 0 1024 >
ffff8d4b5e5b9900 3457879097 S Co:1:022:0 s 21 09 0300 0000 0400 1024 = aa01ff3c 00ff32c8 c8000100 00ffff00 ee020100 00010100 ee020000 00000000
ffff8d4b5e5b9900 3457881896 C Co:1:022:0 0 1024 >
ffff8d4c51c07300 3457942170 S Co:1:022:0 s 21 09 0200 0000 0040 64 = a5030a00 00000000 00000000 00000000 00000000 00000000 00000000 00000000
ffff8d4c51c07300 3457942349 C Co:1:022:0 0 64 >
ffff8d4cdb293780 3458005309 S Co:1:022:0 s 21 09 0200 0000 0040 64 = ac000000 00000000 00000000 00000000 00000000 00000000 00000000 00000000
ffff8d4cdb293780 3458005542 C Co:1:022:0 0 64 >
ffff8d4c51d21900 3458068967 S Co:1:022:0 s 21 09 0200 0000 0040 64 = 09000000 00000000 00000000 00000000 00000000 00000000 00000000 00000000
ffff8d4c51d21900 3458069210 C Co:1:022:0 0 64 >
ffff8d4b5bf98f00 3514902358 S Co:1:022:0 s 21 09 0300 0000 0400 1024 = aa000084 ffff32c8 c8000000 00ffff00 ee020100 00010100 ee020000 00000000
ffff8d4b5bf98f00 3514905144 C Co:1:022:0 0 1024 >
ffff8d4c43f5ef00 3514971580 S Co:1:022:0 s 21 09 0300 0000 0400 1024 = aa01ff3c 00ff32c8 c8000100 f0fd0000 fa000100 10030000 fa000000 00000000
ffff8d4c43f5ef00 3514974276 C Co:1:022:0 0 1024 >
ffff8d4c4ec3a3c0 3515036022 S Co:1:022:0 s 21 09 0200 0000 0040 64 = a5030a00 00000000 00000000 00000000 00000000 00000000 00000000 00000000
ffff8d4c4ec3a3c0 3515036265 C Co:1:022:0 0 64 >
ffff8d4cdd7f36c0 3515099518 S Co:1:022:0 s 21 09 0200 0000 0040 64 = ac000000 00000000 00000000 00000000 00000000 00000000 00000000 00000000
ffff8d4cdd7f36c0 3515099734 C Co:1:022:0 0 64 >
ffff8d4b5bf9a000 3515162178 S Co:1:022:0 s 21 09 0200 0000 0040 64 = 09000000 00000000 00000000 00000000 00000000 00000000 00000000 00000000
ffff8d4b5bf9a000 3515162356 C Co:1:022:0 0 64 >
ffff8d4b670fa300 3537437654 S Co:1:022:0 s 21 09 0300 0000 0400 1024 = aa000084 ffff32c8 c8000000 fbff0000 ee020100 05010000 ee020000 00000000
ffff8d4b670fa300 3537440350 C Co:1:022:0 0 1024 >
ffff8d4d2086bcc0 3537502747 S Co:1:022:0 s 21 09 0300 0000 0400 1024 = aa01ff3c 00ff32c8 c8000100 fbff0000 ee020100 05010000 ee020000 00000000
ffff8d4d2086bcc0 3537505415 C Co:1:022:0 0 1024 >
ffff8d4b5bf98f00 3537565992 S Co:1:022:0 s 21 09 0200 0000 0040 64 = a5030a00 00000000 00000000 00000000 00000000 00000000 00000000 00000000
ffff8d4b5bf98f00 3537566215 C Co:1:022:0 0 64 >
ffff8d4cdb330540 3537630058 S Co:1:022:0 s 21 09 0200 0000 0040 64 = ac000000 00000000 00000000 00000000 00000000 00000000 00000000 00000000
ffff8d4cdb330540 3537630272 C Co:1:022:0 0 64 >
ffff8d4b55dfecc0 3537692985 S Co:1:022:0 s 21 09 0200 0000 0040 64 = 09000000 00000000 00000000 00000000 00000000 00000000 00000000 00000000
ffff8d4b55dfecc0 3537693175 C Co:1:022:0 0 64 >
ffff8d4c0f501600 3574076270 S Co:1:022:0 s 21 09 0300 0000 0400 1024 = aa01ff3c 00ff32c8 c8000100 00fefb00 ee020100 00020500 ee020000 00000000
ffff8d4c0f501600 3574078826 C Co:1:022:0 0 1024 >
ffff8d4c500bd480 3574141876 S Co:1:022:0 s 21 09 0200 0000 0040 64 = a5030a00 00000000 00000000 00000000 00000000 00000000 00000000 00000000
ffff8d4c500bd480 3574142086 C Co:1:022:0 0 64 >
ffff8d4c4ec3af00 3574204463 S Co:1:022:0 s 21 09 0200 0000 0040 64 = ac000000 00000000 00000000 00000000 00000000 00000000 00000000 00000000
ffff8d4c4ec3af00 3574204716 C Co:1:022:0 0 64 >
ffff8d4c4f20ccc0 3574268043 S Co:1:022:0 s 21 09 0200 0000 0040 64 = 09000000 00000000 00000000 00000000 00000000 00000000 00000000 00000000
ffff8d4c4f20ccc0 3574268275 C Co:1:022:0 0 64 >
ffff8d4b5befc180 3591166044 S Co:1:022:0 s 21 09 0300 0000 0400 1024 = aa00ff3c 00ff32c8 c8000000 19000000 a3000100 ea000000 b8000200 19190000
ffff8d4b5befc180 3591168608 C Co:1:022:0 0 1024 >
ffff8d4b5bf2ee40 3591219536 S Co:1:022:0 s 21 09 0300 0000 0400 1024 = aa01ff3c 00ff32c8 c8000100 19000000 a3000100 ea000000 b8000200 19190000
ffff8d4b5bf2ee40 3591221864 C Co:1:022:0 0 1024 >
ffff8d4cd9971b40 3591282142 S Co:1:022:0 s 21 09 0200 0000 0040 64 = a5030a00 00000000 00000000 00000000 00000000 00000000 00000000 00000000
ffff8d4cd9971b40 3591282359 C Co:1:022:0 0 64 >
ffff8d4d20a0f300 3591346075 S Co:1:022:0 s 21 09 0200 0000 0040 64 = ac000000 00000000 00000000 00000000 00000000 00000000 00000000 00000000
ffff8d4d20a0f300 3591346341 C Co:1:022:0 0 64 >
ffff8d4cd98d4600 3591409308 S Co:1:022:0 s 21 09 0200 0000 0040 64 = 09000000 00000000 00000000 00000000 00000000 00000000 00000000 00000000
ffff8d4cd98d4600 3591409524 C Co:1:022:0 0 64 >
ffff8d4b4e5d2b40 3597181308 S Co:1:022:0 s 21 09 0300 0000 0400 1024 = aa00ff3c 00ff32c8 c8000000 19000000 a3000100 ea000000 b8000200 19190000
ffff8d4b4e5d2b40 3597184170 C Co:1:022:0 0 1024 >
ffff8d4c41bc6540 3597235554 S Co:1:022:0 s 21 09 0300 0000 0400 1024 = aa01ff3c 00ff32c8 c8000100 19000000 a3000100 ea000000 b8000200 19190000
ffff8d4c41bc6540 3597238359 C Co:1:022:0 0 1024 >
ffff8d4b50e1b780 3597299247 S Co:1:022:0 s 21 09 0200 0000 0040 64 = a5030a00 00000000 00000000 00000000 00000000 00000000 00000000 00000000
ffff8d4b50e1b780 3597299459 C Co:1:022:0 0 64 >
ffff8d4b0b43de40 3597362404 S Co:1:022:0 s 21 09 0200 0000 0040 64 = ac000000 00000000 00000000 00000000 00000000 00000000 00000000 00000000
ffff8d4b0b43de40 3597362643 C Co:1:022:0 0 64 >
ffff8d4c51807600 3597425431 S Co:1:022:0 s 21 09 0200 0000 0040 64 = 09000000 00000000 00000000 00000000 00000000 00000000 00000000 00000000
ffff8d4c51807600 3597425614 C Co:1:022:0 0 64 >
ffff8d4d209a2900 3605986244 S Co:1:022:0 s 21 09 0300 0000 0400 1024 = aa00ff3c 00ff32c8 c8000000 19000000 a3000100 ea000000 b8000200 19190000
ffff8d4d209a2900 3605988683 C Co:1:022:0 0 1024 >
ffff8d4cdb293cc0 3606047167 S Co:1:022:0 s 21 09 0300 0000 0400 1024 = aa01ff3c 00ff32c8 c8000100 19001900 a3000100 ea00ea00 b8000200 00001900
ffff8d4cdb293cc0 3606049830 C Co:1:022:0 0 1024 >
ffff8d4c501696c0 3606112174 S Co:1:022:0 s 21 09 0200 0000 0040 64 = a5030a00 00000000 00000000 00000000 00000000 00000000 00000000 00000000
ffff8d4c501696c0 3606112379 C Co:1:022:0 0 64 >
ffff8d4c51807cc0 3606174112 S Co:1:022:0 s 21 09 0200 0000 0040 64 = ac000000 00000000 00000000 00000000 00000000 00000000 00000000 00000000
ffff8d4c51807cc0 3606174331 C Co:1:022:0 0 64 >
ffff8d4cdbc5f3c0 3606238437 S Co:1:022:0 s 21 09 0200 0000 0040 64 = 09000000 00000000 00000000 00000000 00000000 00000000 00000000 00000000
ffff8d4cdbc5f3c0 3606238650 C Co:1:022:0 0 64 >
